"Q7M4JXPM","journalArticle","2016","Huff, Connor; Kruszewska, Dominika","Banners, Barricades, and Bombs: The Tactical Choices of Social Movements and Public Opinion","Comparative Political Studies","","0010-4140, 1552-3829","10/f9bmcz","http://journals.sagepub.com/doi/10.1177/0010414015621072","","2016-01-14","2019-10-31 20:34:57","2019-10-31T20:34:57Z","2018-04-10 20:35:46","1774-1808","","13","49","","","Banners, Barricades, and Bombs","","","","","","","en","","","","","CrossRef","","00008","","","","","","","","","","","","","","","","","","","","","","","","","","","","","","","","","","","","","","","","","","","","","","","","","","",""
"UB3JDXQ5","journalArticle","2016","Hidalgo, F. Daniel; Canello, Júlio; Lima-de-Oliveira, Renato","Can Politicians Police Themselves? Natural Experimental Evidence From Brazil’s Audit Courts","Comparative Political Studies","","0010-4140, 1552-3829","10/f9b2zs","http://journals.sagepub.com/doi/10.1177/0010414015626436","","2016-03-03","2019-10-31 20:34:57","2019-10-31T20:34:57Z","2018-04-10 20:35:41","1739-1773","","13","49","","","Can Politicians Police Themselves?","","","","","","","en","","","","","CrossRef","","00008","","","","","","","","","","","","","","","","","","","","","","","","","","","","","","","","","","","","","","","","","","","","","","","","","","",""
"RGUALMGE","journalArticle","2018","Coltheart, Max; Cox, Rochelle; Sowman, Paul; Morgan, Hannah; Barnier, Amanda; Langdon, Robyn; Connaughton, Emily; Teichmann, Lina; Williams, Nikolas; Polito, Vince","Belief, delusion, hypnosis, and the right dorsolateral prefrontal cortex: a transcranial magnetic stimulation study","Cortex","","00109452","10/gdfnrd","http://linkinghub.elsevier.com/retrieve/pii/S0010945218300121","","2018-01-31","2019-10-31 20:34:57","2019-10-31T20:34:57Z","2018-02-06 14:25:01","234-248","","","101","","","Belief, delusion, hypnosis, and the right dorsolateral prefrontal cortex","","","","","","","en","","","","","CrossRef","","00000","","","","","","","","","","","","","","","","","","","","","","","","","","","","","","","","","","","","","","","","","","","","","","","","","","",""
"W7UCCTZC","journalArticle","2017","Samur, Dalya; Tops, Mattie; Koole, Sander L.","Does a single session of reading literary fiction prime enhanced mentalising performance? Four replication experiments of Kidd and Castano (2013)","Cognition and Emotion","","0269-9931, 1464-0600","10/ggb77n","https://www.tandfonline.com/doi/full/10.1080/02699931.2017.1279591","","2017-01-17","2019-10-31 20:34:52","2019-10-31T20:34:52Z","2018-04-04 16:14:39","130-144","","1","32","","","Does a single session of reading literary fiction prime enhanced mentalising performance?","","","","","","","en","","","","","CrossRef","","00008","","","","","","","","","","","","","","","","","","","","","","","","","","","","","","","","","","","","","","","","","","","","","","","","","","",""
"GNZQGKKQ","journalArticle","2018","Ertimur, Yonca; Rawson, Caleb; Rogers, Jonathan L.; Zechman, Sarah L. C.","Bridging the Gap: Evidence from Externally Hired CEOs","Journal of Accounting Research","","00218456","10/gf9c9j","http://doi.wiley.com/10.1111/1475-679X.12200","","2018-01-23","2019-10-31 20:34:51","2019-10-31T20:34:51Z","2018-02-09 15:14:44","521-579","","","","","","Bridging the Gap","","","","","","","en","","","","","CrossRef","","00001","","","","","","","","","","","","","","","","","","","","","","","","","","","","","","","","","","","","","","","","","","","","","","","","","","",""
"G3R5WISG","journalArticle","2018","Hail, Luzi; Tahoun, Ahmed; Wang, Clare","Corporate Scandals and Regulation <sup>*</sup>","Journal of Accounting Research","","00218456","10/gddm4w","http://doi.wiley.com/10.1111/1475-679X.12201","","2018-01-30","2019-10-31 20:34:50","2019-10-31T20:34:50Z","2018-02-09 15:11:59","617-671","","","","","","","","","","","","","en","","","","","CrossRef","","00000","","","","","","","","","","","","","","","","","","","","","","","","","","","","","","","","","","","","","","","","","","","","","","","","","","",""
"TTPEFC6E","journalArticle","2018","Allee, Kristian D.; Deangelis, Matthew D.; Moon, James R.","Disclosure “Scriptability”","Journal of Accounting Research","","00218456","10/gf9h4q","http://doi.wiley.com/10.1111/1475-679X.12203","","2018-02-07","2019-10-31 20:34:50","2019-10-31T20:34:50Z","2018-02-09 15:10:59","313-362","","","","","","","","","","","","","en","","","","","CrossRef","","00000","","","","","","","","","","","","","","","","","","","","","","","","","","","","","","","","","","","","","","","","","","","","","","","","","","",""
"CXURE7P2","journalArticle","2017","Klaschinski, Lukas; Schnabel, Konrad; Schröder-Abé, Michela","Benefits of power posing: effects on dominance and social sensitivity","Comprehensive Results in Social Psychology","","","10/ggb75x","http://www.tandfonline.com/doi/full/10.1080/23743603.2016.1248080","","2017-06-28","2019-10-31 20:34:24","2019-10-31T20:34:24Z","","55-67","","","2","","","Benefits of power posing","","","","","","","","","","","","DataCite","","","","","","","","","","","","","","","","","","","","","","","","","","","","","","","","","","","","","","","","","","","","","","","","","","","","",""
"2V5UR3ZE","journalArticle","2017","Bailey, April H.; LaFrance, Marianne; Dovidio, John F.","Could a woman be superman? Gender and the embodiment of power postures","Comprehensive Results in Social Psychology","","2374-3603, 2374-3611","10/ggb72m","https://www.tandfonline.com/doi/full/10.1080/23743603.2016.1248079","","2017-01-17","2019-10-31 20:33:29","2019-10-31T20:33:29Z","2017-05-04 11:44:53","1-22","","","","","","Could a woman be superman?","","","","","","","en","","","","","CrossRef","","","","","","","","","","","","","","","","","","","","","","","","","","","","","","","","","","","","","","","","","","","","","","","","","","","","",""
"KIT52QNP","journalArticle","2015","Steegen, Sara; Dewitte, Laura; Tuerlinckx, Francis; Vanpaemel, Wolf","Corrigendum: Measuring the crowd within again: a pre-registered replication study","Frontiers in Psychology","","1664-1078","10/ggb72f","http://journal.frontiersin.org/Article/10.3389/fpsyg.2015.00238/abstract","","2015-03-12","2019-10-31 20:33:23","2019-10-31T20:33:23Z","2017-05-05 12:55:32","","","","6","","","Corrigendum","","","","","","","","","","","","CrossRef","","","","","","","","","","","","","","","","","","","","","","","","","","","","","","","","","","","","","","","","","","","","","","","","","","","","",""
"C8X5KKNZ","journalArticle","2014","Schouppe, Nathalie; de Ferrerre, Evelien; Van Opstal, Filip; Braem, Senne; Notebaert, Wim","Conscious and unconscious context-specific cognitive control","Frontiers in Psychology","","1664-1078","10/ggb72c","http://journal.frontiersin.org/article/10.3389/fpsyg.2014.00539/abstract","","2014-06-04","2019-10-31 20:33:23","2019-10-31T20:33:23Z","2017-05-05 12:57:07","","","","5","","","","","","","","","","","","","","","CrossRef","","","","","","","","","","","","","","","","","","","","","","","","","","","","","","","","","","","","","","","","","","","","","","","","","","","","",""