"6IQWQGKM","journalArticle","2013","Archambault, Patrick M.; Belt, Tom H. van de; Iii, Francisco J. Grajales; Faber, Marjan J.; Kuziemsky, Craig E.; Gagnon, Susie; Bilodeau, Andrea; Rioux, Simon; Nelen, Willianne LDM; Gagnon, Marie-Pierre; Turgeon, Alexis F.; Aubin, Karine; Gold, Irving; Poitras, Julien; Eysenbach, Gunther; Kremer, Jan AM; Légaré, France","Wikis and Collaborative Writing Applications in Health Care: A Scoping Review","Journal of Medical Internet Research","","","10/gbd32v","https://www.jmir.org/2013/10/e210/","Background: Collaborative writing applications (eg, wikis and Google Documents) hold the potential to improve the use of evidence in both public health and health care. The rapid rise in their use has created the need for a systematic synthesis of the evidence of their impact as knowledge translation (KT) tools in the health care sector and for an inventory of the factors that affect their use. Objective: Through the Levac six-stage methodology, a scoping review was undertaken to explore the depth and breadth of evidence about the effective, safe, and ethical use of wikis and collaborative writing applications (CWAs) in health care. Methods: Multiple strategies were used to locate studies. Seven scientific databases and 6 grey literature sources were queried for articles on wikis and CWAs published between 2001 and September 16, 2011. In total, 4436 citations and 1921 grey literature items were screened. Two reviewers independently reviewed citations, selected eligible studies, and extracted data using a standardized form. We included any paper presenting qualitative or quantitative empirical evidence concerning health care and CWAs. We defined a CWA as any technology that enables the joint and simultaneous editing of a webpage or an online document by many end users. We performed qualitative content analysis to identify the factors that affect the use of CWAs using the Gagnon framework and their effects on health care using the Donabedian framework. Results: Of the 111 studies included, 4 were experimental, 5 quasi-experimental, 5 observational, 52 case studies, 23 surveys about wiki use, and 22 descriptive studies about the quality of information in wikis. We classified them by theme: patterns of use of CWAs (n=26), quality of information in existing CWAs (n=25), and CWAs as KT tools (n=73). A high prevalence of CWA use (ie, more than 50%) is reported in 58% (7/12) of surveys conducted with health care professionals and students. However, we found only one longitudinal study showing that CWA use is increasing in health care. Moreover, contribution rates remain low and the quality of information contained in different CWAs needs improvement. We identified 48 barriers and 91 facilitators in 4 major themes (factors related to the CWA, users&#8217; knowledge and attitude towards CWAs, human environment, and organizational environment). We also found 57 positive and 23 negative effects that we classified into processes and outcomes. Conclusions: Although we found some experimental and quasi-experimental studies of the effectiveness and safety of CWAs as educational and KT interventions, the vast majority of included studies were observational case studies about CWAs being used by health professionals and patients. More primary research is needed to find ways to address the different barriers to their use and to make these applications more useful for different stakeholders.  [J Med Internet Res 2013;15(10):e210]","2013","2019-10-31 20:37:16","2019-10-31T20:37:16Z","2018-11-02 16:30:07","e210","","10","15","","","Wikis and Collaborative Writing Applications in Health Care","","","","","","","en","Unless stated otherwise, all articles are open-access distributed under the terms of the Creative Commons Attribution License (http://creativecommons.org/licenses/by/2.0/), which permits unrestricted use, distribution, and reproduction in any medium, provided the original work (","","","","www.jmir.org","","00051","","","","","","","","","","","","","","","","","","","","","","","","","","","","","","","","","","","","","","","","","","","","","","","","","","",""
"JRP7N36R","journalArticle","2017","Arpin, Sarah Noel; Froehlich, Laura; Lantian, Anthony; Rudert, Selma Carolin; Stelter, Marleen","When “We” or “They” exclude others: attributing and evaluating ostracism observed in in-groups and out-groups","Comprehensive Results in Social Psychology","","2374-3603, 2374-3611","10/ggb8br","https://www.tandfonline.com/doi/full/10.1080/23743603.2017.1358477","","2017-09-02","2019-10-31 20:35:42","2019-10-31T20:35:42Z","2018-04-03 14:40:35","143-165","","2-3","2","","","When “We” or “They” exclude others","","","","","","","en","","","","","CrossRef","","","","","","","","","","","","","","","","","","","","","","","","","","","","","","","","","","","","","","","","","","","","","","","","","","","","",""
"8HRKAAZ8","journalArticle","2014","Müller, Florian; Rothermund, Klaus","What Does It Take to Activate Stereotypes? Simple Primes Don’t Seem Enough: A Replication of Stereotype Activation (Banaji & Hardin, 1996; Blair & Banaji, 1996)","Social Psychology","","1864-9335, 2151-2590","10/f56dv3","http://econtent.hogrefe.com/doi/abs/10.1027/1864-9335/a000183","","2014-01-01","2019-10-31 20:34:59","2019-10-31T20:34:59Z","2018-04-10 20:39:28","187-193","","3","45","","","What Does It Take to Activate Stereotypes?","","","","","","","en","","","","","CrossRef","","00000","","","","","","","","","","","","","","","","","","","","","","","","","","","","","","","","","","","","","","","","","","","","","","","","","","",""
"2Q43H6B5","journalArticle","2015","van ’t Veer, Anna E.; Gallucci, Marcello; Stel, Mariëlle; Beest, Ilja van","Unconscious deception detection measured by finger skin temperature and indirect veracity judgments—results of a registered report","Frontiers in Psychology","","","10/gf9h52","http://journal.frontiersin.org/article/10.3389/fpsyg.2015.00672/full","A pre-registered experiment was conducted to examine psychophysiological responses to being lied to. Bridging research on social cognition and deception detection, we hypothesized that observing a liar compared to a truth-teller would decrease finger skin temperature of observers. Participants first watched two targets while not forewarned that they would later be asked to judge (direct and indirect) veracity, and then watched another two targets while forewarned about this. During both these phases finger skin temperature was measured. Findings pertaining to temperature partly confirmed our main hypothesis. When participants were observing a liar, irrespective of being forewarned, on average finger skin temperature declined over time. In the forewarned phase, temperature trajectories of truth-tellers were higher than those of liars, however, in the not forewarned phase, this pattern was reversed. Results confirmed our further hypotheses that participants judge liars as less likeable and less trustworthy than truth-tellers—an indication of indirect deception detection. Our hypothesis that the effect size for trustworthiness would be bigger than that of liking was not supported by the data. Additionally, and also confirming our hypothesis, participants performed around chance level when directly judging whether the target person was lying. Exploratory analyses are reported with regard to truth bias and dependency between direct and indirect veracity judgments. Limitations and directions for future work related to the existence of psychophysiological indicators of deception detection are discussed.","2015-06-08","2019-10-31 20:34:58","2019-10-31T20:34:58Z","2016-08-31 17:04:07","672","","","","","Front. Psychol.","","","","","","","","","","","","","Frontiers","","https://osf.io/j8w4i/","","","","deception detection; indirect deception detection; interpersonal relations; physiological markers; psychophysiology; skin temperature","","","","","","","","","","","","","","","","","","","","","","","","","","","","","","","","","","","","","","","","","","","","","","",""
"ITJR3AGQ","journalArticle","2015","Wagenmakers, Eric-Jan; Beek, Titia F.; Rotteveel, Mark; Gierholz, Alex; Matzke, Dora; Steingroever, Helen; Ly, Alexander; Verhagen, Josine; Selker, Ravi; Sasiadek, Adam; Gronau, Quentin F.; Love, Jonathon; Pinto, Yair","Turning the hands of time again: a purely confirmatory replication study and a Bayesian analysis","Frontiers in Psychology","","1664-1078","10/ggb77t","http://journal.frontiersin.org/article/10.3389/fpsyg.2015.00494/full","In a series of four experiments, Topolinski and Sparenberg (2012; TS) found support for the conjecture that clockwise movements induce psychological states of temporal progression and an orientation toward the future and novelty. Here we report the results of a preregistered replication attempt of Experiment 2 from TS. Participants turned kitchen rolls either clockwise or counterclockwise while answering items from a questionnaire assessing openness to experience. Data from 102 participants showed that the effect went slightly in the direction opposite to that predicted by TS, and a preregistered Bayes factor hypothesis test revealed that the data were 10.76 times more likely under the null hypothesis than under the alternative hypothesis. Our findings illustrate the theoretical importance and practical advantages of preregistered Bayes factor replication studies, both for psychological science and for empirical work in general.","2015-04-24","2019-10-31 20:34:58","2019-10-31T20:34:58Z","2017-05-04 21:20:30","","","","6","","Front. Psychol.","Turning the hands of time again","","","","","","","English","","","","","journal.frontiersin.org","","","","","","","","","","","","","","","","","","","","","","","","","","","","","","","","","","","","","","","","","","","","","","","","","","","","",""
"5QECKFTJ","journalArticle","2015","Paris, Tim; Kim, Jeesun; Davis, Chris","Using EEG and stimulus context to probe the modelling of auditory-visual speech","Cortex","","00109452","10/f8c42q","http://linkinghub.elsevier.com/retrieve/pii/S001094521500101X","","2015-04-17","2019-10-31 20:34:57","2019-10-31T20:34:57Z","2017-05-04 21:20:09","220-230","","","75","","","","","","","","","","en","","","","","CrossRef","","","","","","","","","","","","","","","","","","","","","","","","","","","","","","","","","","","","","","","","","","","","","","","","","","","","",""
"FQS5AHZQ","journalArticle","2018","Nevarez, Michael D.; Morrill, Melinda I.; Waldinger, Robert J.","Thriving in midlife: The roles of childhood nurturance and adult defense mechanisms","Journal of Research in Personality","","00926566","10/gdxg62","http://linkinghub.elsevier.com/retrieve/pii/S0092656618300102","","2018-02-04","2019-10-31 20:34:56","2019-10-31T20:34:56Z","2018-02-12 14:11:56","35-41","","","74","","","Thriving in midlife","","","","","","","en","","","","","CrossRef","","","","","","","","","","","","","","","","","","","","","","","","","","","","","","","","","","","","","","","","","","","","","","","","","","","","",""
"SF9ZD5KE","journalArticle","2017","Ivory, Adrienne Holz; Ivory, James D; Lanier, Madison","Video Game Use as Risk Exposure, Protective Incapacitation, or Inconsequential Activity Among University Students: Comparing Approaches in a Unique Risk Environment","Journal of Media Psychology","","1864-1105, 2151-2388","10/ggb7zh","http://econtent.hogrefe.com/doi/10.1027/1864-1105/a000210","","2017-03-21","2019-10-31 20:34:51","2019-10-31T20:34:51Z","2017-03-25 23:14:44","42-53","","1","29","","","Video Game Use as Risk Exposure, Protective Incapacitation, or Inconsequential Activity Among University Students","","","","","","","en","","","","","CrossRef","","","","","","","","","","","","","","","","","","","","","","","","","","","","","","","","","","","","","","","","","","","","","","","","","","","","",""
"P7U29MS3","journalArticle","2019","Przybylski Andrew K.; Weinstein Netta","Violent video game engagement is not associated with adolescents' aggressive behaviour: evidence from a registered report","Royal Society Open Science","","","10/gfvg6h","https://royalsocietypublishing.org/doi/10.1098/rsos.171474","In this study, we investigated the extent to which adolescents who spend time playing violent video games exhibit higher levels of aggressive behaviour when compared with those who do not. A large sample of British adolescent participants (n = 1004) aged 14 and 15 years and an equal number of their carers were interviewed. Young people provided reports of their recent gaming experiences. Further, the violent contents of these games were coded using official EU and US ratings, and carers provided evaluations of their adolescents' aggressive behaviours in the past month. Following a preregistered analysis plan, multiple regression analyses tested the hypothesis that recent violent game play is linearly and positively related to carer assessments of aggressive behaviour. Results did not support this prediction, nor did they support the idea that the relationship between these factors follows a nonlinear parabolic function. There was no evidence for a critical tipping point relating violent game engagement to aggressive behaviour. Sensitivity and exploratory analyses indicated these null effects extended across multiple operationalizations of violent game engagement and when the focus was on another behavioural outcome, namely, prosocial behaviour. The discussion presents an interpretation of this pattern of effects in terms of both the ongoing scientific and policy debates around violent video games, and emerging standards for robust evidence-based policy concerning young people's technology use.","2019","2019-02-22 13:24:04","2019-02-22T13:24:04Z","2019-02-13 13:51:58","171474","","2","6","","Royal Society Open Science","Violent video game engagement is not associated with adolescents' aggressive behaviour","","","","","","","","","","","","royalsocietypublishing.org (Atypon)","","00000","","","","","","","","","","","","","","","","","","","","","","","","","","","","","","","","","","","","","","","","","","","","","","","","","","",""